appln_id;earliest_filing_year;person_ctry_code;cpc_class_symbol;nace2_code;appln_title;appln_abstract
52904789;1996;"US";"Y10S 706/919";"26.2";"Apparatus and method for integrating intelligent manufacturing system with expert sheet metal planning and bending system";"An apparatus and method are provided for integrating an intelligent manufacturing system with an expert sheet metal planning and bending system. The intelligent manufacturing system manages and distributes part design and manufacturing information throughout the locations of a production facility. The expert planning system includes a plurality of expert modules for proposing a bending plan, including bend sequence and tooling selections, and robot motion planning and repositioning. Through the various features and aspects of the present invention, an operator can selectively modify and adapt these integrated systems for particular bend applications, including robot-based and human assisted bending operations."
53100982;1995;"US";"G06T   9/008";"26.2";"Region-based texture coding method and decoding method, and corresponding systems";"The invention relates to an image sequence coding method in which images are segmented and coded with respect to their contours and textures. The texture coding step is carried out by means of a lattice vector quantization method adapted to region-based coding schemes where regions have arbitrary shapes, for applications allowing to reach very low bit rates while keeping a good image quality."
53006062;1996;"US";"G06N   3/008";"26.2";"Affect-based robot communication methods and systems";"An affect-based method of communication between robots is provided by displaying a visual facial expression indicative of a simulated emotional state on a display device of a first robot, and viewing the visual facial expression using a camera on a second robot. The simulated emotional state may be one of happiness, anger, or sadness, for example. The second robot determines the simulated emotional state based upon the visual facial expression. The second robot processes the simulated emotional state to redefine its own simulated emotional state, and to display a visual facial expression indicative thereof. The visual facial expression allows a human observer to discern the simulated emotional state of the robot. Optionally, the robots further communicate affect using audio tones."
52822641;1994;"US";"Y10S 706/924";"26.2";"Patient monitoring system including speech recognition capability";"A patient monitoring system. A patient has access to a telephone. The telephone is operated by a patient. A central monitoring system is coupled to the telephone. The central monitoring system generates questions concerning a health condition of the patient for the patient to answer using the keys of the telephone or by speaking the correct response. The central monitoring system stores answers to the questions for later retrieval. The central monitoring system can include a DTMF modem decoder for receiving and decoding DTMF tones generated by the patient using the touch-tone telephone and transmitted to the central monitoring system. The DTMF tones represent the health condition of the patient. A computer processor is coupled to the DTMF modem decoder. A voice generator is also coupled to the computer processor and generates voice output under the control of the computer processor. The voice output is transmitted to the touch-tone telephone. A database is coupled to the computer processor, storing a patient record reflecting the health condition of the patient and also storing the questions concerning the health condition of the patient."
53940918;1996;"US";"Y10S 706/925";"26.2";"Method and apparatus for foreign exchange rate time series prediction and classification";"A method and apparatus for the prediction of time series data, specifically, the prediction of a foreign currency exchange rate. The method disclosed transforms the time series data into a difference of a series, compresses the transformed data using a log transformation, converts the compressed data into symbols, and subsequently trains one or more neural networks on the symbols such that a prediction is generated. Alternative embodiments demonstrate the conversion by a self-organizing map and training by a recurrent neural network."
52727719;1996;"US";"G06N   3/045";"26.2";"System and method for high speed computing and feature recognition capturing aspects of neocortical computation";"A network of networks system and method includes a neuron having processing capabilities; a first level module including a network of a plurality of interconnected neurons, the first level module also having processing capabilities; and a second level module including a network of interconnected networks or interconnected neurons, the second level module also having processing capabilities; wherein the first and second level modules are interconnected through neuron to neuron connections such that simultaneous processing can be carried out at by the neuron and by the first and second level modules. The system and method also includes means for forming a boundary between a first module having a first memory state and a second module having a second memory state such that the module comprising the boundary attains a third memory state distinct from the first and second memory states."
53587564;1996;"US";"G10L  15/1815";"26.2";"Transaction system based on a bidirectional speech channel by status graph building and problem detection for a human user";"A transaction system has machine recognition of speech. It has dialogue control fed by the recognition, and speech generation fed by the dialogue control for outputting question and verifier statements from a repertoire set. A human-machine dialogue is executed until the dialogue control has recognized a viable transaction formulation with a plurality of user-provided slot fillers to specify the transaction. Dialogue control builds a directed and loopless status graph with nodes that each have their own slot filler and associated metric, and are interrelated through logic relations. The building can amend a node's metric and under control of conflict detection or lowering of a particular node's metric, discard the node in question and its filler, including of derived nodes and also of one-to-one derival nodes of the discarded node. A subset of problems is detected for a particular item outputted by the speech generation for ascertaining a particular slot filler, as combined with a subsequent unsatisfactory recognition. Then the speech generation outputs a further question statement for ascertaining the latter slot filler."
53940918;1996;"US";"G06N   3/049";"26.2";"Method and apparatus for foreign exchange rate time series prediction and classification";"A method and apparatus for the prediction of time series data, specifically, the prediction of a foreign currency exchange rate. The method disclosed transforms the time series data into a difference of a series, compresses the transformed data using a log transformation, converts the compressed data into symbols, and subsequently trains one or more neural networks on the symbols such that a prediction is generated. Alternative embodiments demonstrate the conversion by a self-organizing map and training by a recurrent neural network."
53275000;1996;"US";"G06T   9/008";"26.2";"Method and apparatus for enhanced transaction card compression employing interstitial weights";"A method of encoding and decoding a transaction card with a block of image data digitally representing the features of a digital portrait of an authorized transaction card user is disclosed along with apparatus for performing the method. The encoding method partitions the digital portrait of the transaction card user into feature blocks. Each feature block is compared against a library of like feature blocks to determine the best match with a pair of library feature blocks. The library's feature blocks are derived from a plurality of portraits taken from the general population. Each library feature block is represented (addressed for access) by a code-vector in a codebook. The two code-vectors corresponding to the two closest matching features blocks from the library of like feature blocks are recorded onto a transaction card along with an interstitial pointer which indicates a weight to be allocated to each of the two code-vectors to form a better match for at least one of the library feature blocks to the user's feature blocks. All of the code-vectors and the interstitial pointers corresponding to the user's feature blocks are recorded as a sequence of sub-data blocks within an image data block on the transaction card. A method and associated apparatus for reading out the image data block and recreating a representation of the portrait of the transaction card user at a financial transaction site for identification purposes are also disclosed."
53019924;1996;"US";"G05D   1/0077";"26.2";"Low cost redundant communications system";"A communications system capable of providing enhanced data integrity and reliability through redundant buses, and a network interface controller for use therewith. Redundant conductors conforming to well-known ethernet standards interconnect electronics components. Each component communicates with the conductors through a single network interface card (NIC). Each NIC comprises an ethernet compliant transceiver for each ethernet conductor in communication with the component. Microcontrollers embedded in each NIC synchronously and deterministically place data on the ethernet conductors according to a timing scheme stored in a non-volatile memory means. A heartbeat/power monitor is also provided to ensure that data cannot be transmitted in the event of a microcontroller failure. The communications system provides a high degree of redundancy and fault-tolerance and is therefore well-suited to critical applications in avionics communication."
54257356;1994;"US";"G10L  15/26";"26.2";"Speech interface for an automated endoscope system";"A robotic system which controls the movement of a surgical instrument in response to voice commands from the user. The robotic system has a computer controlled arm that holds the surgical instrument. The user provides voice commands to the computer through a microphone. The computer contains a phrase recognizer that matches the user' speech with words stored in the computer. Matched words are then processed to determine whether the user has spoken a robot command. If the user has spoken a recognized robot command the computer will move the robotic arm in accordance with the command."
52675669;1996;"US";"G06N   3/049";"26.2";"Method and apparatus for estimating a cognitive decision made in response to a known stimulus from the corresponding single-event evoked cerebral potential";"The present invention estimates the cognitive decision made in response to a known stimulus from the corresponding single-event evoked cerebral potential. The present invention uses a unique recursive procedure to identify the decision from a mathematical description of the potential as the output of a cerebrally located, autoregressive, moving average filter with the stimulus as an exogenous input. The procedure employs in a two-step sequence, the least squares algorithm to update the filter coefficients, followed by a Taylor's Series approximation for updating an internal cerebral source signal which is generated in response to the external stimulus. The recursive procedure computes the attenuation used by the moving average component of the filter to produce the cerebral source signal. This procedure is repeated for all feasible cerebral source signals, computed from the set of possible event evoked average response potentials, to produce a set of attenuator-values. These values are then used as input to a multiple-layered, feed-forward artificial neural network for identifying the decision made from the set of feasible responses. In turn, the power spectrum computed from the autoregressive coefficients is used to track the cognitive state and therefore the reliability of the decision estimate. The present invention may be used for the control by mental thought of computerized visual and aural display functions, by measuring the electroencephalogram in time with the operant orientation of the user onto a displayed stimulus."
52502403;1994;"US";"Y10S 706/912";"26.2";"Method for monitoring an electric motor and detecting a departure from normal operation";"A method for detecting a departure from normal operation of an electric motor comprises the steps of modelling a set of normal current measurements and a set of operational current measurements for the motor being monitored. The modelling is carried out by a neural network auto-associator which is trained to reproduce its inputs on its output. A potential failure is indicated whenever the set of normal current measurements and the set of operational current measurements differ by more than a predetermined criterion."
53189121;1995;"US";"G06T   9/001";"26.2";"Model-based coding/decoding method and system";"A processing of causing a face image of a person A as an object of encoding to be deformed in correspondence to expression and motion of a face image of a person B as a reference image. The expression change and the motion from the model wire-frame are treated as fitting information, and this fitting information is made WA1 with respect to a first image of an object for photographing, while is made Wb1 with respect to a second image of an object for photographing. For example, the fitting information from a model wire-frame W00 to an image A1 is Wa1, and the fitting information from the image A1 to the model wire-frame W00 is Wa1. Next, an image A2 into which the first image A1 is caused to be deformed by a texture Ta1 of the first image A1 and a wire-frame function Wb1 Wa1 is obtained through composition. Texture mapping of sticking the texture Ta1 in correspondence to each of small areas of this wire-frame is carried out, whereby the image A2 into which the image A1 is caused to be deformed similarly to an image B1 is obtained through composition."
54058632;1996;"US";"A61B   5/7267";"26.2";"Flicker and frequency doubling in virtual reality";"A system for testing and quantifying visual field and other visual function information in a head-mounted virtual reality environment, utilizing a directed image formation device for scanning of a flickering image for display to the test subject. A method and an apparatus are also provided for utilizing a central neural network and a central data bank to perform automatic interpretation of the visual function test parameters obtained in a plurality of visual field testing systems, for a plurality of patients, with control and response signals being transmitted via the Internet. The data produced by the testing systems are automatically analyzed and compared with patterns on which the neural network was previously trained, and clinical diagnoses for pathological conditions are thereby suggested to the respective clinician for each patient."
53587564;1996;"US";"G10L  15/22";"26.2";"Transaction system based on a bidirectional speech channel by status graph building and problem detection for a human user";"A transaction system has machine recognition of speech. It has dialogue control fed by the recognition, and speech generation fed by the dialogue control for outputting question and verifier statements from a repertoire set. A human-machine dialogue is executed until the dialogue control has recognized a viable transaction formulation with a plurality of user-provided slot fillers to specify the transaction. Dialogue control builds a directed and loopless status graph with nodes that each have their own slot filler and associated metric, and are interrelated through logic relations. The building can amend a node's metric and under control of conflict detection or lowering of a particular node's metric, discard the node in question and its filler, including of derived nodes and also of one-to-one derival nodes of the discarded node. A subset of problems is detected for a particular item outputted by the speech generation for ascertaining a particular slot filler, as combined with a subsequent unsatisfactory recognition. Then the speech generation outputs a further question statement for ascertaining the latter slot filler."
53898073;1996;"US";"G05B  13/027";"26.2";"3-brain architecture for an intelligent decision and control system";"A method and system for intelligent control of external devices using a mammalian brain-like structure having three parts. The method and system include a computer-implemented neural network system which is an extension of the model-based adaptive critic design and is applicable to real-time control (e.g., robotic control) and real-time distributed control. Additional uses include data visualization, data mining, and other tasks requiring complex analysis of inter-relationships between data."
339503525;1996;"US";"G06T   9/005";"26.2";"Method for replacing parts of a digitally coded picture, and device for carrying out the method";"A method for replacing parts of a digitally coded picture (11) is proposed. The digitally coded picture (11) may correspond to a sub-picture which is displayed on the screen of a television set (10). In the method, each line of the picture (11) is run length-coded. The replaceable parts of a line of the picture are run length-coded separately. The part which replaces the replaceable, original part of a line of the picture (11) is run length-coded in such a way that it has the same number of data units (data bytes) as the original part of this line of the picture (11). The replacement of the data for the run length coding words is carried out in a memory device (51). The replacement is possible in a simple manner by virtue of the fact that the original part of a line of the picture and the new part of the line of the picture have the same number of data units. Moreover, a device for carrying out the method is also proposed."
53898073;1996;"US";"G05B  13/0285";"26.2";"3-brain architecture for an intelligent decision and control system";"A method and system for intelligent control of external devices using a mammalian brain-like structure having three parts. The method and system include a computer-implemented neural network system which is an extension of the model-based adaptive critic design and is applicable to real-time control (e.g., robotic control) and real-time distributed control. Additional uses include data visualization, data mining, and other tasks requiring complex analysis of inter-relationships between data."
53011951;1995;"US";"G06T2207/20084";"26.2";"Image processing method and device for automatic detection of regions of a predetermined type of cancer in an intensity image";"An image processing method for automatic detection of regions of a predetermined type of cancer in an intensity image of a part of a human or animal body, includes, for a number of points of a part of said image, the determination of a set (referred to as a vector) of components formed by characteristic values derived from the intensity distribution around each point in said part of the image, and the use of a classification system for determining the probability of the point associated with said vector belonging to a region of said part of the image which corresponds to the predetermined type of cancer or to another region. An image processing device for carrying out such a method is utilized in conjunction with a digital medical imaging system."
50538924;1994;"DE";"H04R  25/507";"26.3";"Programmable hearing aid with fuzzy logic control of transmission characteristics";"The programmable hearing aid has a fuzzy controller allocated to the amplifier and transmission circuit, which is connected between the microphone and the earphone, for automatic switching and matching of the transmission characteristics to the current ambient situation. The fuzzy controller undertakes a selection of the parameter sets or parameters stored in a data carrier of the hearing aid for the modification of transmission characteristics of the hearing aid dependent on input quantities characteristic of the current ambient situation."
339503525;1996;"DE";"G06T   9/005";"26.3";"Method for replacing parts of a digitally coded picture, and device for carrying out the method";"A method for replacing parts of a digitally coded picture (11) is proposed. The digitally coded picture (11) may correspond to a sub-picture which is displayed on the screen of a television set (10). In the method, each line of the picture (11) is run length-coded. The replaceable parts of a line of the picture are run length-coded separately. The part which replaces the replaceable, original part of a line of the picture (11) is run length-coded in such a way that it has the same number of data units (data bytes) as the original part of this line of the picture (11). The replacement of the data for the run length coding words is carried out in a memory device (51). The replacement is possible in a simple manner by virtue of the fact that the original part of a line of the picture and the new part of the line of the picture have the same number of data units. Moreover, a device for carrying out the method is also proposed."
54236341;1996;"DE";"G06T   9/001";"26.3";"Method for checking convergence in fractal image coding";"A method is proposed for checking convergence in fractal image coding. In this case, a digitized image is divided into a number of range blocks (Ri, Ri+1) and into a number of domain blocks (Dj, Dk). A similar domain block is determined in relation to each range block. If necessary, in this process a transformation of a domain block is undertaken in order to map the domain block onto a range block. The assignment of the domain block to the range block including the transformation parameters represents the fractal code for the image. A reduced transformation matrix is set up to check convergence of the fractal code. The largest absolute eigenvalue of the transformation matrix is determined approximately. The entire method can be carried out in this case hierarchically. In a first approximation step, at least the row sum norm of each row of the reduced transformation matrix is checked. In further steps, further rows are combined to form square matrices of higher dimension. The latter are used to determine the largest absolute eigenvalues for the purpose of checking convergence."
54198615;1995;"CA";"H04L  45/08";"26.3";"Traffic routing in a telecommunications network";"A telecommunications network comprising a plurality of nodes interconnected via communications paths is configured by the determination of a routing plan for the traffic carried by the network. A set of possible paths, e.g. the eight shortest paths between each pair of network nodes is determined, and each path is allocated a digital code characteristic of that path identity. Groups of paths are selected, each group comprising one path from each set, and for each said group being characterised by a bit string comprising the digital codes of the paths comprising that group. These bit strings are then used as starting values or chromosomes in a genetic algorithm search procedure to generate and evaluate new path groups so as to determine an optimum combination or routing plan of paths between the network nodes."
52805672;1994;"DE";"G06T   9/005";"26.3";"Method and apparatus for generating and reproducing of compressed colored video scenes";"PCT No. PCT/EP95/00590 Sec. 371 Date Nov. 5, 1996 Sec. 102(e) Date Nov. 5, 1996 PCT Filed Feb. 17, 1995 PCT Pub. No. WO95/22869 PCT Pub. Date Aug. 24, 1995The invention refers to a method and an apparatus for generating compressed colored video scenes. In conventional methods and apparatus of this kind the problem arises that a large number of color values is present for each scene. The large number of color values should be reduced such that a pleasant image appears for the viewer. In order to obtain this a RGB color space is spanned wherein all color values of all pixels of all individual images of one video scene are inserted. The RGB color space is divided in 256 color rectangular parallel epipeds, each color parallel epiped containing either the same number of pixels or the same number of color values. All color values in one color rectangular parallel epiped are replaced by a mean color value for this color rectangular parallel epiped. Using these mean color values the individual images of a scene are represented such that with the exception of the first image only a differential image to the previously shown image is generated, only such pixels being unequal 0 the difference thereof exceeding a predetermined threshold value. A data compression of the differential images is carried out. The compressed data are stored in a data memory. During reproduction the data are decompressed and reproduced on a screen under a clock control."
