appln_id;earliest_filing_year;person_ctry_code;cpc_class_symbol;nace2_code;appln_title;appln_abstract
50753569;1995;"US";"G05B2219/33002";"26.51";"Laser aligned robotic machining system for use in rebuilding heavy machinery";"A precision positioning system is used for resurfacing and repairing rails and guideways of large, heavy machinery at users facilities. The system has new components, an entire machining system, a new alignment system, parallel platforms for tool support and surface scanning. A sectioned, portable monorail frame is held by fixed supports at the locus of a heavy machine requiring guideway straightening. Fixed guides extend along the outer surface of the monorail. Guide wheels and drive wheels contact the guides and support and move an outer tubular beam carriage. An assembly of machining tools is adjustably positioned on the carriage. Laser alignment sources and sensors are connected to the carriage and to heavy machines off-axis and parallel to the monorail. Intelligent controls precisely position the tools for resurfacing the rails and guideways. Scanning and a printout of machine guideway accuracy, before and after the operation, provide written verification of quality improvement. The system increases accuracy and speed of machining, reduces chatter and vibration, eliminates imprecise manual determinations, and returns the equipment to acceptable improved tolerances. The system has applications in any machine tool rebuilder or company with a machine tool in need of requalification. Applications also include rail transport, autonomous vehicles, micro-machining, inspection camera positioning, laser machining, material deposition and other operations such as drilling, heat treating, brazing and welding."
53898073;1996;"US";"G05B  13/0285";"26.51";"3-brain architecture for an intelligent decision and control system";"A method and system for intelligent control of external devices using a mammalian brain-like structure having three parts. The method and system include a computer-implemented neural network system which is an extension of the model-based adaptive critic design and is applicable to real-time control (e.g., robotic control) and real-time distributed control. Additional uses include data visualization, data mining, and other tasks requiring complex analysis of inter-relationships between data."
50906012;1995;"US";"G05D   1/0077";"26.51";"Apparatus for synchronizing flight management computers where only the computer chosen to be the master received pilot inputs and transfers the inputs to the spare";"A method and apparatus for choosing which flight management computer (FMC) of two FMCs will function as a master FMC (11) and which will function as a spare FMC (13) in maintaining data commonalty and synchronization between the master FMC (11) and the spare FMC (13) is disclosed. The status of a control switch (15) having FMC select and auto positions is scanned to determine the state of the switch. If the switch (15) is in an FMC select position, the related FMC is chosen to be the master FMC and the other FMC is chosen to be the spare FMC. If the switch is in the auto position, the failure status of the FMCs is evaluated. If one of the FMCs has failed, the other is chosen to be the master FMC. If the FMCs are both operating, the health of the FMCs is evaluated. If both FMCs are healthy, one is chosen to be the master FMC and the other is chosen to be the spare FMC, in accordance with a predetermined protocol. If the health of one of the FMCs has degraded, the other FMC is chosen to be the master FMC. Only the master FMC receives pilot data, which is forwarded to the spare FMC. The master FMC maintains object managers and sends changed data to the spare FMC when a data change occurs. The spare FMC stores the changed data within its own object managers."
52437556;1995;"US";"Y10S 706/90";"26.51";"Method of and apparatus for controlling a process";"The present invention relates to a method of controlling an output variable of a process having long dead times and delay times, for example for controlling the interior temperature of an absorber refrigerator, and also relates to an apparatus for carrying out such a method. The output variable of the process, such as the interior temperature, is sampled and compared with a desired value in order to determine a desired value deviation. In dependence on the determined desired value deviation, a manipulated variable, such as the power supplied to the absorber, is calculated in such a manner that the output variable of the process is brought near to the desired value. After the lapse of a waiting time, a value of the manipulated variable is newly determined. During the waiting time, the manipulated variable is not altered. The waiting time is calculated on the basis of the difference between the value of the manipulated variable and an earlier value of the manipulated variable. A controller for carrying out the method comprises a memory for an earlier calculated manipulated variable and a timer which is designed to receive the earlier calculated value of the manipulated variable and the current value of the manipulated variable, to calculate a waiting time from these and, after the lapse of this waiting time, to start a new calculation of a value for the manipulated variable."
53898073;1996;"US";"G05B  13/027";"26.51";"3-brain architecture for an intelligent decision and control system";"A method and system for intelligent control of external devices using a mammalian brain-like structure having three parts. The method and system include a computer-implemented neural network system which is an extension of the model-based adaptive critic design and is applicable to real-time control (e.g., robotic control) and real-time distributed control. Additional uses include data visualization, data mining, and other tasks requiring complex analysis of inter-relationships between data."
52440333;1996;"US";"G05B  13/0275";"26.51";"Hybrid linear-neural network process control";"A hybrid analyzer having a data derived primary analyzer and an error correction analyzer connected in parallel is disclosed. The primary analyzer, preferably a data derived linear model such as a partial least squares model, is trained using training data to generate major predictions of defined output variables. The error correction analyzer, preferably a neural network model is trained to capture the residuals between the primary analyzer outputs and the target process variables. The residuals generated by the error correction analyzer is summed with the output of the primary analyzer to compensate for the error residuals of the primary analyzer to arrive at a more accurate overall model of the target process. Additionally, an adaptive filter can be applied to the output of the primary analyzer to further capture the process dynamics. The data derived hybrid analyzer provides a readily adaptable framework to build the process model without requiring up-front knowledge. Additionally, the primary analyzer, which incorporates the PLS model, is well accepted by process control engineers. Further, the hybrid analyzer also addresses the reliability of the process model output over the operating range since the primary analyzer can extrapolate data in a predictable way beyond the data used to train the model. Together, the primary and the error correction analyzers provide a more accurate hybrid process analyzer which mitigates the disadvantages, and enhances the advantages, of each modeling methodology when used alone."
52904789;1996;"US";"Y10S 706/919";"26.51";"Apparatus and method for integrating intelligent manufacturing system with expert sheet metal planning and bending system";"An apparatus and method are provided for integrating an intelligent manufacturing system with an expert sheet metal planning and bending system. The intelligent manufacturing system manages and distributes part design and manufacturing information throughout the locations of a production facility. The expert planning system includes a plurality of expert modules for proposing a bending plan, including bend sequence and tooling selections, and robot motion planning and repositioning. Through the various features and aspects of the present invention, an operator can selectively modify and adapt these integrated systems for particular bend applications, including robot-based and human assisted bending operations."
53462231;1996;"US";"B25J   9/1615";"26.51";"Robot having multiple degrees of freedom";"An improvement is set forth in a robotic arm structure which includes at least two links. theta motion is provided about a primary axis at the proximal end portion of the proximalmost of the links. R motion proceeds radially from the primary axis whereby the distal end portion of the distalmost of the links can be moved in a radially extending straight line. An end effector is pivotally mounted for rotation relative to the distal end portion of the distalmost link about an end effector axis which is parallel to the primary axis. The structure is improved by adding one or more of a yaw motor, a roll motor and a pitch motor for rotating the wrist of the arm about the respective axes. A sensor array senses the R, theta , Z and yaw, roll and/or pitch motions and creates and transmits electronic signals representative thereof to a computer controller which monitors and controls the R, theta , Z and yaw, roll and/or pitch motions. Non-radial straight line motion and indeed, in certain embodiments any desired three-dimensional motion, is thereby enabled as is picking up of workpieces such as semiconductor wafers, flat panel displays and data storage disks, which are misaligned in cassettes or at workstations and/or are in cassettes which are misaligned and/or aligned and set up at an angle relative to the usual plane of operation of the arm."
52440333;1996;"US";"G05B  13/027";"26.51";"Hybrid linear-neural network process control";"A hybrid analyzer having a data derived primary analyzer and an error correction analyzer connected in parallel is disclosed. The primary analyzer, preferably a data derived linear model such as a partial least squares model, is trained using training data to generate major predictions of defined output variables. The error correction analyzer, preferably a neural network model is trained to capture the residuals between the primary analyzer outputs and the target process variables. The residuals generated by the error correction analyzer is summed with the output of the primary analyzer to compensate for the error residuals of the primary analyzer to arrive at a more accurate overall model of the target process. Additionally, an adaptive filter can be applied to the output of the primary analyzer to further capture the process dynamics. The data derived hybrid analyzer provides a readily adaptable framework to build the process model without requiring up-front knowledge. Additionally, the primary analyzer, which incorporates the PLS model, is well accepted by process control engineers. Further, the hybrid analyzer also addresses the reliability of the process model output over the operating range since the primary analyzer can extrapolate data in a predictable way beyond the data used to train the model. Together, the primary and the error correction analyzers provide a more accurate hybrid process analyzer which mitigates the disadvantages, and enhances the advantages, of each modeling methodology when used alone."
52437556;1995;"US";"G05B  13/0275";"26.51";"Method of and apparatus for controlling a process";"The present invention relates to a method of controlling an output variable of a process having long dead times and delay times, for example for controlling the interior temperature of an absorber refrigerator, and also relates to an apparatus for carrying out such a method. The output variable of the process, such as the interior temperature, is sampled and compared with a desired value in order to determine a desired value deviation. In dependence on the determined desired value deviation, a manipulated variable, such as the power supplied to the absorber, is calculated in such a manner that the output variable of the process is brought near to the desired value. After the lapse of a waiting time, a value of the manipulated variable is newly determined. During the waiting time, the manipulated variable is not altered. The waiting time is calculated on the basis of the difference between the value of the manipulated variable and an earlier value of the manipulated variable. A controller for carrying out the method comprises a memory for an earlier calculated manipulated variable and a timer which is designed to receive the earlier calculated value of the manipulated variable and the current value of the manipulated variable, to calculate a waiting time from these and, after the lapse of this waiting time, to start a new calculation of a value for the manipulated variable."
54058632;1996;"US";"A61B   5/7267";"26.7";"Flicker and frequency doubling in virtual reality";"A system for testing and quantifying visual field and other visual function information in a head-mounted virtual reality environment, utilizing a directed image formation device for scanning of a flickering image for display to the test subject. A method and an apparatus are also provided for utilizing a central neural network and a central data bank to perform automatic interpretation of the visual function test parameters obtained in a plurality of visual field testing systems, for a plurality of patients, with control and response signals being transmitted via the Internet. The data produced by the testing systems are automatically analyzed and compared with patterns on which the neural network was previously trained, and clinical diagnoses for pathological conditions are thereby suggested to the respective clinician for each patient."
52280015;1996;"US";"G10L  15/24";"26.7";"Automated synchronization of video image sequences to new soundtracks";"The synchronization of an existing video to a new soundtrack is carried out through the phonetic analysis of the original soundtrack and the new soundtrack. Individual speech sounds, such as phones, are identified in the soundtrack for the original video recording, and the images corresponding thereto are stored. The new soundtrack is similarly analyzed to identify individual speech sounds, which are used to select the stored images and create a new video sequence. The sequence of images are then smoothly fitted to one another, to provide a video stream that is synchronized to the new soundtrack. This approach permits a given video sequence to be synchronized to any arbitrary utterance. Furthermore, the matching of the video images to the new speech sounds can be carried out in a highly automated manner, thereby reducing required manual effort."
49406040;1994;"US";"G10L  15/26";"26.7";"Voice recognition of recorded messages for photographic printers";"In a camera and printer system, apparatus and methods for recording or storing voice messages in message memory associated with an exposed image frame for reproduction as an annotation with prints made from the exposed image frames. The messages may be recorded on magnetic film layers or stored in camera on-board memory or in detachable message memory modules or cards to be forwarded with the exposed film strip to a photofinisher for read out and printing on the prints. The printer includes a voice recognition system for voice recognition of words spoken by the user and stored in the memory means and provided to the photofinisher. The messages to be printed may be stored or recorded by the user in real time with each exposure or at an earlier time to be reproduced on each print made subsequently. Notes may be temporarily stored with the making of each exposure, read out at a later time and used in the composition and recording in the memory of the message to be printed after voice recognition. Alternatively, or in addition, the composed messages made from the notes may be manually recorded in machine readable form, and the printer may include a character recognition system for reading out the recorded words for reproduction as the annotation on the prints."
51114106;1996;"US";"A61B   5/7267";"26.7";"Visual function testing with virtual retinal display";"A system for testing and quantifying visual field and other visual function information in a head-mounted virtual reality environment, utilizing a directed image formation device for scanning of an image onto the retina of the test subject. A method and an apparatus are also provided for utilizing a central neural network and a central data bank to perform automatic interpretation of the visual function test parameters obtained in a plurality of visual field testing systems, for a plurality of patients, with control and response signals being transmitted via the Internet. The data produced by the testing systems are automatically analyzed and compared with patterns on which the neural network was previously trained, and clinical diagnoses for pathological conditions are thereby suggested to the respective clinician for each patient."
49405288;1994;"US";"G10L  15/26";"26.7";"Camera on-board voice recognition";"In a camera, apparatus and methods for recording or storing voiced in messages in message memory associated with an exposed image frame for reproduction as an annotation with prints made from the exposed image frames. The camera includes a voice recognition system for voice recognition of words spoken by the user before the words are stored in message memory. Fixed and adjustable vocabularies are provided for use in the voice recognition. The adjustable vocabulary may be loaded into the camera by a vocabulary memory card or through an interface with a docking station of a personal computer or vending machine so that an adjustable vocabulary of words of interest to the camera user or related to a scene or event of photographic interest may be employed in the voice recognition. The messages may be recorded on magnetic film layers or stored in camera on-board memory or in detachable message memory modules to be forwarded with the exposed film strip to a photofinisher for read out and printing on the prints. The messages may be stored or recorded by the user in real time with each exposure or at an earlier or later time."
53035524;1995;"US";"F03D   7/046";"27.1";"Performance optimization controller and control method for doubly-fed machines";"A variable speed, constant frequency (VSCF) system utilizes a doubly-fed machine (DFM) to maximize the output power of the system. The system includes a power converter that provides a frequency signal and a current signal to the DFM. The power converter is controlled by an adaptive controller. The controller signals the converter to vary its frequency signal and thereby the rotor speed of the DFM until a maximum power output is sensed. The controller also signals the converter to vary its current signal and thereby the portions of power carried by the respective windings until a maximum power output is sensed. The control can be augmented to not only maximize power and efficiency, but also provide for harmonic and reactive power compensation."
49435461;1994;"US";"H01M   8/04992";"27.1";"Fuel cell powered propulsion system";"An apparatus for directly powering a unipolar electric motor with direct current (DC) power includes a control mechanism, and a solid oxide fuel cell (SOFC) having a fuel input and an oxidizer input. The control mechanism may control the fuel input and the oxidizer input. The fuel input may utilize a hydrocarbon fuel or, alternatively, an arbitrary mixture of hydrogen and carbon monoxide. The electric motor may have a field excitation current and the control mechanism may further control the field excitation current. Alternatively, an apparatus may power a vehicle, such as a ship or automobile, and may include an electric motor for powering the vehicle, a fuel cell for providing fuel cell power, a turbine-generator for providing turbine-generator power, and a control mechanism. The electric motor may include a motor power input. The fuel cell may include a fuel input, a fuel cell oxidizer input, a thermal exhaust output, and a fuel cell power output. The turbine-generator may include a compressor for pressurizing oxidizer, a generator for producing a generator power output, and a turbine for driving the compressor and the generator. The generator power output may supplement the fuel cell power output in order to produce power for the motor power input. The turbine may have a thermal exhaust input interconnected with the thermal exhaust output of the fuel cell. The compressor may have a compressor oxidizer input and an oxidizer output interconnected with the fuel cell oxidizer input. The control mechanism may control the fuel input, the compressor oxidizer input or the field excitation current."
49435461;1994;"US";"H01M   8/04992";"27.2";"Fuel cell powered propulsion system";"An apparatus for directly powering a unipolar electric motor with direct current (DC) power includes a control mechanism, and a solid oxide fuel cell (SOFC) having a fuel input and an oxidizer input. The control mechanism may control the fuel input and the oxidizer input. The fuel input may utilize a hydrocarbon fuel or, alternatively, an arbitrary mixture of hydrogen and carbon monoxide. The electric motor may have a field excitation current and the control mechanism may further control the field excitation current. Alternatively, an apparatus may power a vehicle, such as a ship or automobile, and may include an electric motor for powering the vehicle, a fuel cell for providing fuel cell power, a turbine-generator for providing turbine-generator power, and a control mechanism. The electric motor may include a motor power input. The fuel cell may include a fuel input, a fuel cell oxidizer input, a thermal exhaust output, and a fuel cell power output. The turbine-generator may include a compressor for pressurizing oxidizer, a generator for producing a generator power output, and a turbine for driving the compressor and the generator. The generator power output may supplement the fuel cell power output in order to produce power for the motor power input. The turbine may have a thermal exhaust input interconnected with the thermal exhaust output of the fuel cell. The compressor may have a compressor oxidizer input and an oxidizer output interconnected with the fuel cell oxidizer input. The control mechanism may control the fuel input, the compressor oxidizer input or the field excitation current."
51052536;1996;"US";"H01M   8/04992";"27.2";"Fuel cell power supply system";"A power supply system for enhancing the economic viability of different modes of transportation that incorporate fuel cells to generate electricity. For example, the power supply system of the present invention provides for the off-board use of the electric power generated by an on-board power plant, such as a fuel cell, of a mobile vehicle power system, such as an electric car. Off-board use, or use remote from the vehicle, of the electrical power includes the delivery of power to a remote site. Off-board stations are provided for delivery of fuel to the vehicle and/or for receiving the electrical power generated by the fuel cell. The off-board station and the vehicle are appropriately equipped for quick and easy interconnection such that electrical power is drawn from the fuel cell for off-board use."
52931877;1996;"US";"H01M   8/04992";"27.2";"Fuel cell power supply system";"A power supply system for enhancing the economic viability of different modes of transportation that incorporate fuel cells to generate electricity. For example, the power supply system of the present invention provides for the off-board use of the electric power generated by an on-board power plant, such as a fuel cell, of a mobile vehicle power system, such as an electric car. Off-board use, or use remote from the vehicle, of the electrical power includes the delivery of power to a remote site. Off-board stations are provided for delivery of fuel to the vehicle and/or for receiving the electrical power generated by the fuel cell. The off-board station and the vehicle are appropriately equipped for quick and easy interconnection such that electrical power is drawn from the fuel cell for off-board use."
49892966;1996;"US";"H01M   8/04992";"27.2";"Off-board station and an electricity exchanging system suitable for use with a mobile vehicle power system";"A mobile vehicle power supply system and an electricity exchanging system enhance the economic viability of different modes of transportation that incorporate generators, such as electric motors and fuel cells, to generate electricity. The power supply system provides for the off-board use of the electric power generated by the generator of a mobile vehicle, such as an electric car. Off-board use, or use remote from the vehicle, of the electrical power includes the delivery of power to a remote site. Off-board stations are provided for delivery of fuel to the vehicle and/or for receiving the electrical power generated by the fuel cell. The off-board station and the vehicle are appropriately equipped for quick and easy interconnection such that electrical power can be exchanged between the vehicle and off-board station and the electricity exchanging system. The electricity exchanging system is configured for installation at numerous locations for allowing a mobile vehicle operator to purchase or sell electricity. The operator employs a user authorization element to assist the recording or tracking of electricity exchanged between the vehicle and the electricity exchanging system."
