appln_id;earliest_filing_year;person_ctry_code;cpc_class_symbol;nace2_code;appln_title;appln_abstract
52030029;1995;"US";"G10L  15/22";"28.23";"Method and apparatus for providing a human-machine dialog supportable by operator intervention";"Successive sections of a computer program of a user interactive system are carried out. A user presents successive verbal items such as answers, to verbal items such as questions presented by the system. Each question corresponds to a respective program section. The user item is recognized and a next machine item is presented, if possible and appropriate. The recognizing is evaluated, and on the basis of the evaluating a progress score is kept. If the progress score attains a particular level, the system enables an operator to intervene in the dialogue in an unobtrusive manner. If a plurality of dialogs are supervised in parallel, the enabling is on the basis of a progress ranking among the dialogs. The intervention may be realized by emulating a user item in the form of speech or in the form of a mechanically entered user item."
51943315;1995;"US";"G10L  15/08";"28.23";"Method and system for performing speech recognition";"Speech recognition processing is compensated for improving robustness of speech recognition in the presence of enhanced speech signals. The compensation overcomes the adverse effects that speech signal enhancement may have on speech recognition performance, where speech signal enhancement causes acoustical mismatches between recognition models trained using unenhanced speech signals and feature data extracted from enhanced speech signals. Compensation is provided at the front end of an automatic speech recognition system by combining linear predictive coding and mel-based cepstral parameter analysis for computing cepstral features of transmitted speech signals used for speech recognition processing by selectively weighting mel-filter banks when processing frequency domain representations of the enhanced speech signals."
52502403;1994;"US";"Y10S 706/911";"28.23";"Method for monitoring an electric motor and detecting a departure from normal operation";"A method for detecting a departure from normal operation of an electric motor comprises the steps of modelling a set of normal current measurements and a set of operational current measurements for the motor being monitored. The modelling is carried out by a neural network auto-associator which is trained to reproduce its inputs on its output. A potential failure is indicated whenever the set of normal current measurements and the set of operational current measurements differ by more than a predetermined criterion."
52502403;1994;"US";"G06N   3/065";"28.23";"Method for monitoring an electric motor and detecting a departure from normal operation";"A method for detecting a departure from normal operation of an electric motor comprises the steps of modelling a set of normal current measurements and a set of operational current measurements for the motor being monitored. The modelling is carried out by a neural network auto-associator which is trained to reproduce its inputs on its output. A potential failure is indicated whenever the set of normal current measurements and the set of operational current measurements differ by more than a predetermined criterion."
52502403;1994;"US";"Y10S 706/912";"28.23";"Method for monitoring an electric motor and detecting a departure from normal operation";"A method for detecting a departure from normal operation of an electric motor comprises the steps of modelling a set of normal current measurements and a set of operational current measurements for the motor being monitored. The modelling is carried out by a neural network auto-associator which is trained to reproduce its inputs on its output. A potential failure is indicated whenever the set of normal current measurements and the set of operational current measurements differ by more than a predetermined criterion."
52502403;1994;"US";"H02H   1/0092";"28.23";"Method for monitoring an electric motor and detecting a departure from normal operation";"A method for detecting a departure from normal operation of an electric motor comprises the steps of modelling a set of normal current measurements and a set of operational current measurements for the motor being monitored. The modelling is carried out by a neural network auto-associator which is trained to reproduce its inputs on its output. A potential failure is indicated whenever the set of normal current measurements and the set of operational current measurements differ by more than a predetermined criterion."
50476232;1995;"US";"G10L  15/26";"28.23";"Voice interactive sportscard";"A voice interactive sportscard, which through the use of an electronic microchip speech recognition, synthesis, and control processing device, actively draws the attention of the user by generating an interactive and changing conversation with the user, or the user may participate and be in audience between a set of voice interactive sportscards having their own group conversation. Generate physical interaction with the user by the use of a micro-vibrator and protect the voice interactive sportscard artwork from wear by the use of a non-mechanical touch sensitive activation/mode switch."
51991722;1995;"US";"G10L  15/20";"28.23";"Time-varying feature space preprocessing procedure for telephone based speech recognition";"An improved speech recognition system, in which transformation process parameters are generated in response to selected characteristics derived from speech inputs obtained from both carbon and linear microphones. The transformation process parameters are utilized in conjunction with selected digitized speech models to improve the speech recognition process based on the carbon microphone property of suppressing speech spectral energy for low energy invoiced sounds, and also for low energy regions of the spectrum between formant peaks for voices sounds."
52211272;1996;"US";"G10L  15/063";"28.23";"System and method for preventing enrollment of confusable patterns in a reference database";"A system and method for increasing the reliability of data matches between data stored in a database and newly provided data. The system relies on the prescreening of newly provided data patterns to insure that any newly provided data pattern is not ambiguous with existing data patterns. A threshold level is calculated for each newly provided data pattern and the invention determines which stored data pattern is closest to, or most likely to be confused with, the newly provided data pattern. The invention temporarily prohibits the new data pattern from being added to the database if it is likely to be confused with a stored data pattern. A user can then choose either to change the new data pattern to a different pattern or to allow the potentially confusing new data pattern to be added to the database. The calculated threshold levels can be set for both individual users and groups of users. The data patterns can consist of speech, images, graphs or other data.\!"
52924694;1996;"US";"G10L  15/142";"28.23";"Speech recognition and verification system enabling authorized data transmission over networked computer systems";"A system and apparatus for using speech recognition and verification to provide secure and authorized data transmissions between networked computer systems is provided. The system includes first and second network computer systems wherein a request for a transaction by user of the first computer system causes the user to be prompted to enter a spoken identifier such as a credit card number, PIN number or password. This spoken identifier is converted from speech data into speech feature data using either a resident software application or a downloaded application from the second computer system. The speech feature data is transmitted to the second computer system wherein speech recognition and verification engines identify the spoken identifier and determine whether or not the user who spoke the identifier is properly associated with the spoken identifier. Upon successful completion of this recognition and verification process, the requested transaction is completed."
53681654;1994;"US";"G10L  17/22";"28.23";"Speech controlled telephone credit card verification system";"A speech controlled verification system for verifying the identity of a person using a telephone calling card, bank card or other credit card. The systems connects the user of the card to a telephone network, wherein the user enters the card number. The card number is used to access a central data base through the telephone network, wherein a voice verification template is retrieved corresponding to the entered card number. The voice verification contains various samples of the authorized user's voice stating selected words, phrases and/or numbers. Once the proper voice verification template is retrieved, the system prompts the user to state one of the words, phrases and/or numbers contained within the voice verification template. The word, phrase and/or numbers stated in response to the prompt is compared with the voice verification template. If the stated words match the template, the user is considered to be the authorized user and the card is validated. If the stated words do not match the voice verification template, the user may or may not be denied authorization depending upon the use of the card and the financial stake being placed in the use of the card."
54243429;1996;"US";"G10L  15/1815";"28.23";"Method of and system for recognizing a spoken text";"A system for recognizing spoken text includes a microphone for converting spoken text uttered by a speaker into analog electrical signals. An analog to digital converter to convert the analog spoken text data into digital electronic signals. A speech recognition device uses a lexicon data device; a language model data device; and a reference data device to convert the digital spoken text into recognized text data. The system also includes a keyboard for entering error correction data and an error correction device which generates corrected text depending on the corrected text. Adaptation apparatus of the lexicon data device and adaption apparatus of the language model data device, adapt the lexicon data and the language model data respectively to the speaker depending on the corrected text. Then a second speech recognition process is carried out by the speech recognition device depending on the original spoken text, the adapted lexicon data and the adapted language model data to generate newly recognized repeated text which is transmitted to the reference data device. Adaption apparatus of the reference data device or speech recognition device, adapt the reference data to the speaker depending on the recognized repeated text."
53459648;1996;"US";"G10L  17/14";"28.23";"Text independent speaker recognition for transparent command ambiguity resolution and continuous access control";"Feature vectors representing each of a plurality of overlapping frames of an arbitrary, text independent speech signal are computed and compared to vector parameters and variances stored as codewords in one or more codebooks corresponding to each of one or more enrolled users to provide speaker dependent information for speech recognition and/or ambiguity resolution. Other information such as aliases and preferences of each enrolled user may also be enrolled and stored, for example, in a database. Correspondence of the feature vectors may be ranked by closeness of correspondence to a codeword entry and the number of frames corresponding to each codebook are accumulated or counted to identify a potential enrolled speaker. The differences between the parameters of the feature vectors and codewords in the codebooks can be used to identify a new speaker and an enrollment procedure can be initiated. Continuous authorization and access control can be carried out based on any utterance either by verification of the authorization of a speaker of a recognized command or comparison with authorized commands for the recognized speaker. Text independence also permits coherence checks to be carried out for commands to validate the recognition process."
54243429;1996;"US";"G10L  15/18";"28.23";"Method of and system for recognizing a spoken text";"A system for recognizing spoken text includes a microphone for converting spoken text uttered by a speaker into analog electrical signals. An analog to digital converter to convert the analog spoken text data into digital electronic signals. A speech recognition device uses a lexicon data device; a language model data device; and a reference data device to convert the digital spoken text into recognized text data. The system also includes a keyboard for entering error correction data and an error correction device which generates corrected text depending on the corrected text. Adaptation apparatus of the lexicon data device and adaption apparatus of the language model data device, adapt the lexicon data and the language model data respectively to the speaker depending on the corrected text. Then a second speech recognition process is carried out by the speech recognition device depending on the original spoken text, the adapted lexicon data and the adapted language model data to generate newly recognized repeated text which is transmitted to the reference data device. Adaption apparatus of the reference data device or speech recognition device, adapt the reference data to the speaker depending on the recognized repeated text."
53587564;1996;"US";"G10L  15/22";"28.23";"Transaction system based on a bidirectional speech channel by status graph building and problem detection for a human user";"A transaction system has machine recognition of speech. It has dialogue control fed by the recognition, and speech generation fed by the dialogue control for outputting question and verifier statements from a repertoire set. A human-machine dialogue is executed until the dialogue control has recognized a viable transaction formulation with a plurality of user-provided slot fillers to specify the transaction. Dialogue control builds a directed and loopless status graph with nodes that each have their own slot filler and associated metric, and are interrelated through logic relations. The building can amend a node's metric and under control of conflict detection or lowering of a particular node's metric, discard the node in question and its filler, including of derived nodes and also of one-to-one derival nodes of the discarded node. A subset of problems is detected for a particular item outputted by the speech generation for ascertaining a particular slot filler, as combined with a subsequent unsatisfactory recognition. Then the speech generation outputs a further question statement for ascertaining the latter slot filler."
53587564;1996;"US";"G10L  15/1815";"28.23";"Transaction system based on a bidirectional speech channel by status graph building and problem detection for a human user";"A transaction system has machine recognition of speech. It has dialogue control fed by the recognition, and speech generation fed by the dialogue control for outputting question and verifier statements from a repertoire set. A human-machine dialogue is executed until the dialogue control has recognized a viable transaction formulation with a plurality of user-provided slot fillers to specify the transaction. Dialogue control builds a directed and loopless status graph with nodes that each have their own slot filler and associated metric, and are interrelated through logic relations. The building can amend a node's metric and under control of conflict detection or lowering of a particular node's metric, discard the node in question and its filler, including of derived nodes and also of one-to-one derival nodes of the discarded node. A subset of problems is detected for a particular item outputted by the speech generation for ascertaining a particular slot filler, as combined with a subsequent unsatisfactory recognition. Then the speech generation outputs a further question statement for ascertaining the latter slot filler."
54244429;1996;"US";"H04L2025/03464";"28.23";"Waveform equalizer and memory device having a waveform equalizer";"A waveform equalizer comprises a preamplifier for amplifying the reproduced signal read out of a disk by means of an optical pick-up and the reproduced signal is converted into a digital signal by means of an A/D converter adapted to carrying out sampling operations with the data clock cycle. The reproduced signal waveform of the digital signal is subjected to a waveform equalizing process so as to minimize the mean square error relative to the amplitude of the target equalization waveform by means of linear operations. Additionally, the sample values of the reproduced signal waveform that is linearly equalized are nonlinearly equalized by neural network type operations."
54243429;1996;"US";"G10L  15/26";"28.23";"Method of and system for recognizing a spoken text";"A system for recognizing spoken text includes a microphone for converting spoken text uttered by a speaker into analog electrical signals. An analog to digital converter to convert the analog spoken text data into digital electronic signals. A speech recognition device uses a lexicon data device; a language model data device; and a reference data device to convert the digital spoken text into recognized text data. The system also includes a keyboard for entering error correction data and an error correction device which generates corrected text depending on the corrected text. Adaptation apparatus of the lexicon data device and adaption apparatus of the language model data device, adapt the lexicon data and the language model data respectively to the speaker depending on the corrected text. Then a second speech recognition process is carried out by the speech recognition device depending on the original spoken text, the adapted lexicon data and the adapted language model data to generate newly recognized repeated text which is transmitted to the reference data device. Adaption apparatus of the reference data device or speech recognition device, adapt the reference data to the speaker depending on the recognized repeated text."
53275000;1996;"US";"G06T   9/008";"28.23";"Method and apparatus for enhanced transaction card compression employing interstitial weights";"A method of encoding and decoding a transaction card with a block of image data digitally representing the features of a digital portrait of an authorized transaction card user is disclosed along with apparatus for performing the method. The encoding method partitions the digital portrait of the transaction card user into feature blocks. Each feature block is compared against a library of like feature blocks to determine the best match with a pair of library feature blocks. The library's feature blocks are derived from a plurality of portraits taken from the general population. Each library feature block is represented (addressed for access) by a code-vector in a codebook. The two code-vectors corresponding to the two closest matching features blocks from the library of like feature blocks are recorded onto a transaction card along with an interstitial pointer which indicates a weight to be allocated to each of the two code-vectors to form a better match for at least one of the library feature blocks to the user's feature blocks. All of the code-vectors and the interstitial pointers corresponding to the user's feature blocks are recorded as a sequence of sub-data blocks within an image data block on the transaction card. A method and associated apparatus for reading out the image data block and recreating a representation of the portrait of the transaction card user at a financial transaction site for identification purposes are also disclosed."
53459648;1996;"US";"G10L  15/065";"28.23";"Text independent speaker recognition for transparent command ambiguity resolution and continuous access control";"Feature vectors representing each of a plurality of overlapping frames of an arbitrary, text independent speech signal are computed and compared to vector parameters and variances stored as codewords in one or more codebooks corresponding to each of one or more enrolled users to provide speaker dependent information for speech recognition and/or ambiguity resolution. Other information such as aliases and preferences of each enrolled user may also be enrolled and stored, for example, in a database. Correspondence of the feature vectors may be ranked by closeness of correspondence to a codeword entry and the number of frames corresponding to each codebook are accumulated or counted to identify a potential enrolled speaker. The differences between the parameters of the feature vectors and codewords in the codebooks can be used to identify a new speaker and an enrollment procedure can be initiated. Continuous authorization and access control can be carried out based on any utterance either by verification of the authorization of a speaker of a recognized command or comparison with authorized commands for the recognized speaker. Text independence also permits coherence checks to be carried out for commands to validate the recognition process."
53459648;1996;"US";"G10L  17/04";"28.23";"Text independent speaker recognition for transparent command ambiguity resolution and continuous access control";"Feature vectors representing each of a plurality of overlapping frames of an arbitrary, text independent speech signal are computed and compared to vector parameters and variances stored as codewords in one or more codebooks corresponding to each of one or more enrolled users to provide speaker dependent information for speech recognition and/or ambiguity resolution. Other information such as aliases and preferences of each enrolled user may also be enrolled and stored, for example, in a database. Correspondence of the feature vectors may be ranked by closeness of correspondence to a codeword entry and the number of frames corresponding to each codebook are accumulated or counted to identify a potential enrolled speaker. The differences between the parameters of the feature vectors and codewords in the codebooks can be used to identify a new speaker and an enrollment procedure can be initiated. Continuous authorization and access control can be carried out based on any utterance either by verification of the authorization of a speaker of a recognized command or comparison with authorized commands for the recognized speaker. Text independence also permits coherence checks to be carried out for commands to validate the recognition process."
52596390;1994;"US";"G10L  17/00";"28.23";"Auto-dialer housing";"An auto-dialer suitable for use as a smart card capable of being acoustically coupled to a telephone and being reprogrammed in response to acoustic signals. The programming and other features of the auto-dialer can be enabled or disabled by the auto-dialer in response to persecuted signals, e.g., a string of DTMF tones. Encryption of calling card and other data into destination telephone numbers is achieved by selectively altering persecuted characteristics of a DTMF tone sequence, such as the duration of tones, the period of silence between tones and the twist between Lo-band and Hi-band tones of DTMF tone pairs in a DTMF tone sequence representing a telephone number. The encryption of data into the telephone number does not affect the ability of standard telephone switching circuitry to recognize the destination number. However, information encrypted into the DTMF signals is undetectable to standard telephone switching circuitry because it is encrypted using DTMF signal characteristics not normally used to represent data. The auto-dialer has a system clock used to drive a pseudo random number generator used in various data security schemes. Calibration features permit the calibration of the audio output and system clock with adjustments being made via the acoustic programming of the auto-dialer with various calibration factors."
53858622;1995;"US";"G10L  15/183";"28.23";"Method and apparatus for adapting the language model's size in a speech recognition system";"PCT No. PCT/EP95/04337 Sec. 371 Date Sep. 25, 1997 Sec. 102(e) Date Sep. 25, 1997 PCT Filed Nov. 4, 1995 PCT Pub. No. WO97/17694 PCT Pub. Date May 15, 1997In this speech recognition system, the size of the language model is reduced by discarding those n-grams that the acoustic part of the system can recognize most accurately without support from a language model. The n-grams can be discarded dynamically during the running of the system or during the build or setup-time of the system. Trigrams occurring infrequently in the text corpora are substituted for the discarded n-grams to increase the accuracy of the word recognitions."
